{
  "text":   { "threshold": 0.1, "beams": 4, "topk": null, "ahead": 1, "width": 1, "repetition": null, "diversity": null },
  "enum":   { "threshold": 0.1, "width": 1 },
  "branch": { "threshold": 0.1, "width": 1 },
  "flow":   { "threshold": 0.1, "width": 1 },
  "queue":  { "metric": ["perplexity"] }
}
